Category,Weight (%),Description,Subcategories Count
Team,25,The team's ability to execute is critical for early-stage startups,4
Technology,20,"Technological foundation, including blockchain implementation",4
Market Opportunity,20,"Size, growth potential, and competitive dynamics of target market",4
Blockchain Factors,15,Factors unique to decentralized technologies and ecosystems,4
Business Model & Traction,15,Ability to generate revenue and demonstrate market validation,4
Risk & Exit Potential,5,Risks that could derail startup and likelihood of successful exit,4
